qty,name,price,description,status,photo_url
500,Votes,150,Struggling to get support on your terrible healthcare plan? Don't sweat it. We have the right amount of votes to push you over the edge.,active,https://live.staticflickr.com/65535/48983261251_e8d0cd6263_o.jpg
1,Ted Cruz,100,"Once the prince charming of the party, Lyin' Ted can help get you a small margin of votes and maybe an oat milk latte or two.",active,https://live.staticflickr.com/65535/48983214336_fdb72ff925_o.jpg
1,Mitt Romney,15,A deal! Act fast or he might strap your dog to the roof of his Subaru Outback and go on a road trip to Mount Zion!,active,https://live.staticflickr.com/65535/48983261326_32ec5b1cec_o.jpg
2,Greenland,200,"It is Greenland or Iceland? Who knows. Either way, a great distraction while you're getting impeached.",active,https://live.staticflickr.com/65535/48983451537_615a12a4c0_o.jpg
10,Yacht,500,Just your generic yacht. Not much else to add.,retired,https://live.staticflickr.com/65535/48983451342_cc4f23fd56_o.jpg
5,Media Company,400,Low in stock! Don't wait to scare all the senior citizens that sharia law has arrived in Cleveland!,active,https://live.staticflickr.com/65535/48983451657_bd88c4aa96.jpg
60,Gold Toilet,100,How rich are you if you don't even have one of these?,active,https://live.staticflickr.com/65535/48983261271_f31d26d17c_o.jpg
1,A.G. Bill Barr,25,"In a pinch? Don't worry, this dude will defend your every sin and deny being present in the room while it happened.",active,https://live.staticflickr.com/65535/48983273786_98216c5742_o.jpg
10,Endangered Rhino Horn,1000,Limited time only! The last of its kind! Won't return for sale!,active,https://live.staticflickr.com/65535/48983261366_e73b885af7_o.png